{
  "schema": "ouro.run-request/v1",
  "work": {
    "source": {
      "system": "github",
      "type": "issue",
      "id": "semigrp/example#1",
      "version": "updated-at:2026-07-14T00:00:00Z"
    },
    "title": "Execute one pinned procedure"
  },
  "experiment": {
    "system": "bouro",
    "type": "experiment",
    "id": "EXP-0001",
    "version": "1"
  },
  "contextQuery": {
    "schema": "bouro.context-query/v1",
    "roots": [
      {
        "system": "bouro",
        "type": "experiment",
        "id": "EXP-0001",
        "version": "1"
      }
    ],
    "purpose": "execute a reproducible Ouro run",
    "tokenBudget": 4000,
    "allowedSensitivities": ["public", "internal"]
  },
  "procedure": {
    "definition": {
      "system": "bouro",
      "type": "procedure",
      "id": "PROC-0001",
      "version": "1"
    },
    "artifact": {
      "system": "github",
      "type": "file",
      "id": "semigrp/example:procedures/run.mjs",
      "version": "0123456789abcdef",
      "uri": "procedures/run.mjs",
      "digest": "sha256:1111111111111111111111111111111111111111111111111111111111111111"
    },
    "runtime": "node",
    "args": [],
    "inputs": { "message": "hello" },
    "permissionTier": "inspect",
    "timeoutMs": 30000,
    "retries": 1,
    "environment": { "inherit": ["PATH"] }
  },
  "workspace": {
    "ref": {
      "system": "ouro",
      "type": "workspace",
      "id": "WS-EXAMPLE",
      "version": "1"
    },
    "path": "/workspace"
  },
  "gates": [
    { "id": "exit-zero", "type": "exit_code", "expected": 0 }
  ],
  "evidence": {
    "when": "success",
    "title": "Pinned procedure completed",
    "observation": "The procedure passed its exit-code gate."
  }
}
